{"cohorts":[{"definition":"All evaluable benchmark rows after the task-independent zero-byte-media amendment.","id":"complete-evaluable","media_clusters":1808,"records":1819,"valid_tasks":3636},{"definition":"Evaluable rows excluding record identifiers referenced during development.","id":"id-disjoint-evaluable","media_clusters":1749,"records":1760,"valid_tasks":3518},{"definition":"Predefined primary cohort excluding development-referenced rows and byte-identical media aliases.","id":"primary","media_clusters":1727,"records":1735,"valid_tasks":3468},{"definition":"Evaluable rows in the upstream paper-comparable subset.","id":"paper-comparable-evaluable","media_clusters":1662,"records":1673,"valid_tasks":3344}],"dataset":{"name":"ONE-Lab/GUI-World","revision":"7901fa3f0b9e36afa87d24ff9ecd48037c7fd6a0","split":"benchmark"},"limitations":["Cost values are estimates from the frozen price table, not a provider invoice.","Latency summarizes authenticated reader responses and includes provider variability.","Subgroup results are descriptive and are not adjusted for multiple comparisons.","The released screen text changes only the authenticated first-line format preamble; event bytes and all screen-text bytes after that line match the evaluated product.","The 1,819-record equivalence run executed the authenticated unstripped binary. The release executable is its twice-reproduced GNU strip --strip-all derivative; the stripped file was not rerun across the full corpus.","Strict evaluated equivalence uses an authenticated mixed-host composition: 1,815 records from the base run and four AVX2/FMA/no-AVX-512 replacements. The base-to-replacement diagnostic differed in 4 of 1,819 event streams and 2 of 1,819 screen bodies. The receipt does not bind the base host ISA, so cross-CPU byte invariance is not claimed.","terminal-tolerant sensitivity with one authenticated ambiguous transport; no noninferiority or equivalence claim","The primary result treats the ambiguous transport terminal as missing and incorrect; the complete-case sensitivity excludes its affected task pair."],"product":{"equivalence_execution_binary":{"bytes":12912952,"sha256":"a80e32664cd467fda606d3a6b1256ad0d26a5a9ad0e166353631fb18c0fc88f1"},"equivalence_receipt":{"bytes":12840,"sha256":"524ccda5026b05f92ba72ad2762180a478bae8fde0600cea9e6ee1bfa78c1db2"},"model_archive":{"bytes":6400000,"sha256":"623b117bc719a302f5e7ab9a59fba2b19b8ab3a45770c588d6a839a6f10a8ea7"},"model_manifest":{"bytes":3713,"sha256":"14b47e927ce2589636d92031df4c01434828b7a737f06c6f284c2f43fd03c7c5"},"release_binary":{"bytes":9457304,"sha256":"c791889fa5bc3f85a8398dddc0901ff3cf4f9bb84777fe48bf7e1f3c58c33b4a"},"scored_binary_sha256":"f3d5a318ff3571c1f1a1aafb22d21d9257722eef3d16522c7c2cc7c8901bf9e2"},"product_source":{"algorithm":"sha256(canonical-json-public-product-source-v1)","bytes":960763,"files":98,"sha256":"3e2e5d1d108f6f52d08edc4d0217a3ebd6f993ab163e0db7af29441ee09b78ab"},"reader_policy":{"image_detail":"high","max_output_tokens":16384,"model":"gpt-6-luna","reasoning_effort":"low","service_tier":"high","store":false,"trials":3},"results":[{"cohort":"complete-evaluable","metric":"naky-task-majority-accuracy","sample_size":3636,"slice":"overall","unit":"fraction","value":0.827007701},{"cohort":"complete-evaluable","metric":"naky-scenario-macro-accuracy","sample_size":3636,"slice":"overall","unit":"fraction","value":0.818950276},{"cohort":"complete-evaluable","metric":"naky-pooled-call-accuracy","sample_size":10908,"slice":"overall","unit":"fraction","value":0.824257426},{"cohort":"complete-evaluable","metric":"naky-invalid-tasks","sample_size":3636,"slice":"overall","unit":"count","value":39},{"cohort":"complete-evaluable","metric":"naky-invalid-task-rate","sample_size":3636,"slice":"overall","unit":"fraction","value":0.010726072607260726},{"cohort":"complete-evaluable","metric":"screenshots-task-majority-accuracy","sample_size":3636,"slice":"overall","unit":"fraction","value":0.882013201},{"cohort":"complete-evaluable","metric":"screenshots-scenario-macro-accuracy","sample_size":3636,"slice":"overall","unit":"fraction","value":0.877505009},{"cohort":"complete-evaluable","metric":"screenshots-pooled-call-accuracy","sample_size":10908,"slice":"overall","unit":"fraction","value":0.877521085},{"cohort":"complete-evaluable","metric":"screenshots-invalid-tasks","sample_size":3636,"slice":"overall","unit":"count","value":11},{"cohort":"complete-evaluable","metric":"screenshots-invalid-task-rate","sample_size":3636,"slice":"overall","unit":"fraction","value":0.003025302530253025},{"ci95_high":-0.043333979,"ci95_low":-0.066868465,"cohort":"complete-evaluable","metric":"paired-task-majority-delta","sample_size":3636,"slice":"overall","unit":"fraction","value":-0.055005501},{"cohort":"complete-evaluable","metric":"paired-wins","sample_size":3636,"slice":"overall","unit":"count","value":139},{"cohort":"complete-evaluable","metric":"paired-losses","sample_size":3636,"slice":"overall","unit":"count","value":339},{"cohort":"complete-evaluable","metric":"paired-ties","sample_size":3636,"slice":"overall","unit":"count","value":3140},{"cohort":"complete-evaluable","metric":"paired-unresolved","sample_size":3636,"slice":"overall","unit":"count","value":18},{"cohort":"id-disjoint-evaluable","metric":"naky-task-majority-accuracy","sample_size":3518,"slice":"overall","unit":"fraction","value":0.827458783},{"cohort":"id-disjoint-evaluable","metric":"naky-scenario-macro-accuracy","sample_size":3518,"slice":"overall","unit":"fraction","value":0.818943361},{"cohort":"id-disjoint-evaluable","metric":"naky-pooled-call-accuracy","sample_size":10554,"slice":"overall","unit":"fraction","value":0.824805761},{"cohort":"id-disjoint-evaluable","metric":"naky-invalid-tasks","sample_size":3518,"slice":"overall","unit":"count","value":38},{"cohort":"id-disjoint-evaluable","metric":"naky-invalid-task-rate","sample_size":3518,"slice":"overall","unit":"fraction","value":0.010801591813530414},{"cohort":"id-disjoint-evaluable","metric":"screenshots-task-majority-accuracy","sample_size":3518,"slice":"overall","unit":"fraction","value":0.882888005},{"cohort":"id-disjoint-evaluable","metric":"screenshots-scenario-macro-accuracy","sample_size":3518,"slice":"overall","unit":"fraction","value":0.878034309},{"cohort":"id-disjoint-evaluable","metric":"screenshots-pooled-call-accuracy","sample_size":10554,"slice":"overall","unit":"fraction","value":0.878339966},{"cohort":"id-disjoint-evaluable","metric":"screenshots-invalid-tasks","sample_size":3518,"slice":"overall","unit":"count","value":10},{"cohort":"id-disjoint-evaluable","metric":"screenshots-invalid-task-rate","sample_size":3518,"slice":"overall","unit":"fraction","value":0.0028425241614553724},{"ci95_high":-0.043279874,"ci95_low":-0.067444903,"cohort":"id-disjoint-evaluable","metric":"paired-task-majority-delta","sample_size":3518,"slice":"overall","unit":"fraction","value":-0.055429221},{"cohort":"id-disjoint-evaluable","metric":"paired-wins","sample_size":3518,"slice":"overall","unit":"count","value":133},{"cohort":"id-disjoint-evaluable","metric":"paired-losses","sample_size":3518,"slice":"overall","unit":"count","value":328},{"cohort":"id-disjoint-evaluable","metric":"paired-ties","sample_size":3518,"slice":"overall","unit":"count","value":3039},{"cohort":"id-disjoint-evaluable","metric":"paired-unresolved","sample_size":3518,"slice":"overall","unit":"count","value":18},{"cohort":"primary","metric":"naky-task-majority-accuracy","sample_size":3468,"slice":"overall","unit":"fraction","value":0.826124567},{"cohort":"primary","metric":"naky-scenario-macro-accuracy","sample_size":3468,"slice":"overall","unit":"fraction","value":0.818121953},{"cohort":"primary","metric":"naky-pooled-call-accuracy","sample_size":10404,"slice":"overall","unit":"fraction","value":0.823625529},{"cohort":"primary","metric":"naky-invalid-tasks","sample_size":3468,"slice":"overall","unit":"count","value":38},{"cohort":"primary","metric":"naky-invalid-task-rate","sample_size":3468,"slice":"overall","unit":"fraction","value":0.010957324106113034},{"cohort":"primary","metric":"screenshots-task-majority-accuracy","sample_size":3468,"slice":"overall","unit":"fraction","value":0.882064591},{"cohort":"primary","metric":"screenshots-scenario-macro-accuracy","sample_size":3468,"slice":"overall","unit":"fraction","value":0.877671214},{"cohort":"primary","metric":"screenshots-pooled-call-accuracy","sample_size":10404,"slice":"overall","unit":"fraction","value":0.87745098},{"cohort":"primary","metric":"screenshots-invalid-tasks","sample_size":3468,"slice":"overall","unit":"count","value":10},{"cohort":"primary","metric":"screenshots-invalid-task-rate","sample_size":3468,"slice":"overall","unit":"fraction","value":0.0028835063437139563},{"ci95_high":-0.043828981,"ci95_low":-0.068208092,"cohort":"primary","metric":"paired-task-majority-delta","sample_size":3468,"slice":"overall","unit":"fraction","value":-0.055940023},{"cohort":"primary","metric":"paired-wins","sample_size":3468,"slice":"overall","unit":"count","value":131},{"cohort":"primary","metric":"paired-losses","sample_size":3468,"slice":"overall","unit":"count","value":325},{"cohort":"primary","metric":"paired-ties","sample_size":3468,"slice":"overall","unit":"count","value":2994},{"cohort":"primary","metric":"paired-unresolved","sample_size":3468,"slice":"overall","unit":"count","value":18},{"cohort":"paper-comparable-evaluable","metric":"naky-task-majority-accuracy","sample_size":3344,"slice":"overall","unit":"fraction","value":0.829246411},{"cohort":"paper-comparable-evaluable","metric":"naky-scenario-macro-accuracy","sample_size":3344,"slice":"overall","unit":"fraction","value":0.822466359},{"cohort":"paper-comparable-evaluable","metric":"naky-pooled-call-accuracy","sample_size":10032,"slice":"overall","unit":"fraction","value":0.825956938},{"cohort":"paper-comparable-evaluable","metric":"naky-invalid-tasks","sample_size":3344,"slice":"overall","unit":"cou